num,utt,날씨 묻기,관광지 추천,숙소 추천,맛집 추천,인사,소개,활동 추천,카페 추천
3828,저번주 서귀포 날씨 궁금해요.,0,0,1,0,0,0,0,0
3829,이번주 제주 서부 날씨 어떠니?,0,0,1,0,0,0,0,0
3830,내일 모레 제주공항 날씨 상태 어떠니?,0,0,1,0,0,0,0,0
3831,이번에 애월 날씨 상태 알고 싶어요.,0,0,1,0,0,0,0,0
3832,지금 제주공항 날씨 알고 싶어요.,0,0,1,0,0,0,0,0
3833,현재 서귀포 기온 알려줘.,0,0,1,0,0,0,0,0
3834,지금 제주 서부 날씨 상태 말해줘.,0,0,1,0,0,0,0,0
3835,지금 서귀포 날씨 상태 어떠니?,0,0,1,0,0,0,0,0
3836,오늘 애월 날씨 상황 어떤지 알려줘.,0,0,1,0,0,0,0,0
3837,지금 애월 기온 알고 싶어.,0,0,1,0,0,0,0,0
3838,현재 제주 서부 날씨 궁금해요.,0,0,1,0,0,0,0,0
3839,내일 모레 서귀포 기상 정보 어떠니?,0,0,1,0,0,0,0,0
3840,이번주 서귀포 날씨 궁금해.,0,0,1,0,0,0,0,0
3841,이번주 성산일출봉 근처 기온 어떤지 알려줘.,0,0,1,0,0,0,0,0
3842,오늘 제주 서부 기온 궁금하다.,0,0,1,0,0,0,0,0
3843,다음주 성산일출봉 근처 날씨 상태 알고 싶어.,0,0,1,0,0,0,0,0
3844,저번주 제주 동부 날씨 알고 싶어요.,0,0,1,0,0,0,0,0
3845,이번주 성산일출봉 근처 날씨 상황 궁금해.,0,0,1,0,0,0,0,0
3846,지금 서귀포 날씨 상황 말해줘.,0,0,1,0,0,0,0,0
3847,이번에 제주공항 근처 날씨 상태 말해줘.,0,0,1,0,0,0,0,0
3848,이번주 제주공항 기온 알려 줄래?,0,0,1,0,0,0,0,0
3849,저번주 제주공항 근처 기상 정보 어떤지 알려줘.,0,0,1,0,0,0,0,0
3850,다음주 성산일출봉 근처 날씨 상태 알려줘.,0,0,1,0,0,0,0,0
3851,내일 모레 우도 날씨 알려 줄래?,0,0,1,0,0,0,0,0
3852,이번주 제주 기상 정보 말해줘.,0,0,1,0,0,0,0,0
3853,저번주 서귀포 날씨 상태 알고 싶어요.,0,0,1,0,0,0,0,0
3854,내일 성산일출봉 근처 날씨 궁금해.,0,0,1,0,0,0,0,0
3855,다음주 제주공항 근처 날씨 상태 어떤가요?,0,0,1,0,0,0,0,0
3856,이번에 우도 기온 어떤지 알려줘.,0,0,1,0,0,0,0,0
3857,현재 애월 기상 정보 알고 싶어.,0,0,1,0,0,0,0,0
3858,내일 제주공항 날씨 상태 알고 싶어요.,0,0,1,0,0,0,0,0
3859,이번에 제주 동부 기상 정보 궁금해요.,0,0,1,0,0,0,0,0
3860,이번에 서귀포 기상 정보 궁금하다.,0,0,1,0,0,0,0,0
3861,내일 서귀포 기온 알고 싶어요.,0,0,1,0,0,0,0,0
3862,오늘 우도 기상 정보 궁금해요.,0,0,1,0,0,0,0,0
3863,이번주 제주 서부 날씨 어때요?,0,0,1,0,0,0,0,0
3864,다음주 제주공항 근처 날씨 어때요?,0,0,1,0,0,0,0,0
3865,이번주 제주공항 근처 날씨 알고 싶어요.,0,0,1,0,0,0,0,0
3866,저번주 성산일출봉 근처 기상 정보 말해줘.,0,0,1,0,0,0,0,0
3867,이번에 제주공항 기온 알려줘.,0,0,1,0,0,0,0,0
3868,내일 모레 서귀포 날씨 궁금하다.,0,0,1,0,0,0,0,0
3869,이번주 애월 기온 어떠니?,0,0,1,0,0,0,0,0
3870,이번에 제주 서부 날씨 상황 어때요?,0,0,1,0,0,0,0,0
3871,현재 제주 서부 기온 알고 싶어.,0,0,1,0,0,0,0,0
3872,현재 성산일출봉 근처 날씨 어떤가요?,0,0,1,0,0,0,0,0
3873,이번주 우도 기상 정보 알려 줄래?,0,0,1,0,0,0,0,0
3874,이번에 제주공항 날씨 상황 궁금해요.,0,0,1,0,0,0,0,0
3875,다음주 우도 기상 정보 알려 줄래?,0,0,1,0,0,0,0,0
3876,내일 애월 날씨 알려줘.,0,0,1,0,0,0,0,0
3877,내일 모레 제주 동부 날씨 어떤가요?,0,0,1,0,0,0,0,0
3878,오늘 서귀포 기상 정보 알고 싶어요.,0,0,1,0,0,0,0,0
3879,현재 우도 날씨 상황 알고 싶어.,0,0,1,0,0,0,0,0
3880,지금 제주공항 날씨 상황 궁금하다.,0,0,1,0,0,0,0,0
3881,현재 제주공항 근처 날씨 상태 알려 줄래?,0,0,1,0,0,0,0,0
3882,저번주 우도 날씨 궁금해.,0,0,1,0,0,0,0,0
3883,저번주 서귀포 기온 알려줘.,0,0,1,0,0,0,0,0
3884,내일 모레 제주공항 날씨 상태 어떤지 알려줘.,0,0,1,0,0,0,0,0
3885,오늘 제주 날씨 상태 어떤지 알려줘.,0,0,1,0,0,0,0,0
3886,현재 서귀포 기온 어떤지 알려줘.,0,0,1,0,0,0,0,0
3887,내일 제주공항 근처 날씨 상태 말해줘.,0,0,1,0,0,0,0,0
3888,오늘 우도 날씨 궁금해.,0,0,1,0,0,0,0,0
3889,다음주 제주 동부 날씨 상태 알려줘.,0,0,1,0,0,0,0,0
3890,이번주 제주 동부 기상 정보 말해줘.,0,0,1,0,0,0,0,0
3891,이번주 제주 날씨 상황 알고 싶어.,0,0,1,0,0,0,0,0
3892,이번에 성산일출봉 근처 기상 정보 궁금하다.,0,0,1,0,0,0,0,0
3893,이번주 서귀포 기온 알려줘.,0,0,1,0,0,0,0,0
3894,내일 제주 서부 기상 정보 알려 줄래?,0,0,1,0,0,0,0,0
3895,이번에 성산일출봉 근처 기상 정보 궁금해요.,0,0,1,0,0,0,0,0
3896,지금 제주공항 근처 날씨 상태 궁금하다.,0,0,1,0,0,0,0,0
3897,내일 제주 서부 기상 정보 어때요?,0,0,1,0,0,0,0,0
3898,저번주 성산일출봉 근처 기상 정보 알고 싶어요.,0,0,1,0,0,0,0,0
3899,현재 애월 날씨 알고 싶어.,0,0,1,0,0,0,0,0
3900,이번주 제주공항 근처 날씨 상황 어떤가요?,0,0,1,0,0,0,0,0
3901,내일 제주 기온 알고 싶어.,0,0,1,0,0,0,0,0
3902,이번에 서귀포 기온 궁금해.,0,0,1,0,0,0,0,0
3903,이번에 제주공항 근처 날씨 어떤지 알려줘.,0,0,1,0,0,0,0,0
3904,이번에 제주 서부 날씨 말해줘.,0,0,1,0,0,0,0,0
3905,이번주 제주 서부 날씨 알고 싶어.,0,0,1,0,0,0,0,0
3906,이번에 제주공항 기온 알려 줄래?,0,0,1,0,0,0,0,0
3907,다음주 제주공항 날씨 궁금해요.,0,0,1,0,0,0,0,0
3908,이번주 우도 날씨 어떤지 알려줘.,0,0,1,0,0,0,0,0
3909,현재 제주공항 근처 날씨 상태 궁금해.,0,0,1,0,0,0,0,0
3910,내일 모레 서귀포 날씨 알려 줄래?,0,0,1,0,0,0,0,0
3911,이번에 제주 동부 날씨 궁금해.,0,0,1,0,0,0,0,0
3912,지금 애월 날씨 알고 싶어요.,0,0,1,0,0,0,0,0
3913,내일 서귀포 날씨 궁금해요.,0,0,1,0,0,0,0,0
3914,내일 제주공항 근처 기상 정보 어떤지 알려줘.,0,0,1,0,0,0,0,0
3915,저번주 애월 날씨 상황 알려줘.,0,0,1,0,0,0,0,0
3916,지금 성산일출봉 근처 기상 정보 궁금해.,0,0,1,0,0,0,0,0
3917,내일 모레 제주공항 근처 기온 알려줘.,0,0,1,0,0,0,0,0
3918,오늘 서귀포 날씨 알고 싶어요.,0,0,1,0,0,0,0,0
3919,내일 모레 제주공항 날씨 상태 알려 줄래?,0,0,1,0,0,0,0,0
3920,이번주 서귀포 날씨 알고 싶어.,0,0,1,0,0,0,0,0
3921,이번에 서귀포 기온 알고 싶어.,0,0,1,0,0,0,0,0
3922,이번에 제주 서부 날씨 어떠니?,0,0,1,0,0,0,0,0
3923,지금 제주 날씨 상황 알려줘.,0,0,1,0,0,0,0,0
3924,현재 제주공항 기상 정보 알고 싶어.,0,0,1,0,0,0,0,0
3925,이번에 성산일출봉 근처 날씨 상황 궁금하다.,0,0,1,0,0,0,0,0
3926,이번에 제주 서부 날씨 상태 알고 싶어요.,0,0,1,0,0,0,0,0
3927,오늘 성산일출봉 근처 기상 정보 어떠니?,0,0,1,0,0,0,0,0
3928,저번주 애월 날씨 상태 궁금하다.,0,0,1,0,0,0,0,0
3929,이번주 성산일출봉 근처 기상 정보 알고 싶어.,0,0,1,0,0,0,0,0
3930,내일 모레 제주 서부 날씨 상황 어떠니?,0,0,1,0,0,0,0,0
3931,내일 모레 애월 날씨 상태 알려 줄래?,0,0,1,0,0,0,0,0
3932,이번주 서귀포 기상 정보 알고 싶어.,0,0,1,0,0,0,0,0
3933,이번주 제주공항 날씨 상황 궁금해.,0,0,1,0,0,0,0,0
3934,지금 제주공항 근처 날씨 알려줘.,0,0,1,0,0,0,0,0
3935,다음주 제주공항 근처 기상 정보 알려줘.,0,0,1,0,0,0,0,0
3936,현재 제주 동부 기상 정보 궁금하다.,0,0,1,0,0,0,0,0
3937,이번주 제주 날씨 상태 궁금해.,0,0,1,0,0,0,0,0
3938,다음주 우도 기온 궁금하다.,0,0,1,0,0,0,0,0
3939,이번에 제주 날씨 상황 궁금해요.,0,0,1,0,0,0,0,0
3940,이번에 제주 서부 기온 궁금해.,0,0,1,0,0,0,0,0
3941,지금 제주공항 기온 궁금하다.,0,0,1,0,0,0,0,0
3942,오늘 제주 기상 정보 궁금해.,0,0,1,0,0,0,0,0
3943,내일 모레 제주공항 근처 기상 정보 궁금해.,0,0,1,0,0,0,0,0
3944,이번주 서귀포 기상 정보 알려 줄래?,0,0,1,0,0,0,0,0
3945,저번주 성산일출봉 근처 날씨 알려줘.,0,0,1,0,0,0,0,0
3946,저번주 애월 날씨 어때요?,0,0,1,0,0,0,0,0
3947,이번주 서귀포 날씨 상황 알고 싶어.,0,0,1,0,0,0,0,0
3948,내일 모레 애월 기온 궁금해.,0,0,1,0,0,0,0,0
3949,이번주 제주공항 날씨 알고 싶어요.,0,0,1,0,0,0,0,0
3950,현재 애월 날씨 어떤지 알려줘.,0,0,1,0,0,0,0,0
3951,오늘 제주공항 근처 날씨 상태 궁금해.,0,0,1,0,0,0,0,0
3952,다음주 우도 기온 알고 싶어.,0,0,1,0,0,0,0,0
3953,이번에 제주 기상 정보 어떤가요?,0,0,1,0,0,0,0,0
3954,내일 모레 제주공항 근처 기상 정보 궁금해요.,0,0,1,0,0,0,0,0
3955,내일 모레 성산일출봉 근처 날씨 상황 궁금해요.,0,0,1,0,0,0,0,0
3956,이번주 성산일출봉 근처 기온 궁금해요.,0,0,1,0,0,0,0,0
3957,이번에 제주공항 기상 정보 알려줘.,0,0,1,0,0,0,0,0
3958,내일 제주 기온 알려 줄래?,0,0,1,0,0,0,0,0
3959,내일 제주 기온 궁금해.,0,0,1,0,0,0,0,0
3960,오늘 제주 서부 날씨 궁금해요.,0,0,1,0,0,0,0,0
3961,다음주 제주 날씨 상태 궁금하다.,0,0,1,0,0,0,0,0
3962,내일 모레 제주 기온 알고 싶어.,0,0,1,0,0,0,0,0
3963,이번주 애월 날씨 알고 싶어.,0,0,1,0,0,0,0,0
3964,오늘 제주공항 근처 날씨 궁금해요.,0,0,1,0,0,0,0,0
3965,다음주 제주 날씨 어떤가요?,0,0,1,0,0,0,0,0
3966,오늘 우도 날씨 상황 어떤지 알려줘.,0,0,1,0,0,0,0,0
3967,현재 애월 날씨 상황 알고 싶어요.,0,0,1,0,0,0,0,0
3968,저번주 제주 서부 기온 어떤가요?,0,0,1,0,0,0,0,0
3969,지금 제주 동부 날씨 상태 어떠니?,0,0,1,0,0,0,0,0
3970,다음주 제주 날씨 상황 알고 싶어.,0,0,1,0,0,0,0,0
3971,오늘 우도 날씨 상황 알려 줄래?,0,0,1,0,0,0,0,0
3972,현재 서귀포 날씨 상태 어떤지 알려줘.,0,0,1,0,0,0,0,0
3973,현재 제주 서부 날씨 상황 알고 싶어.,0,0,1,0,0,0,0,0
3974,이번주 제주 동부 날씨 상황 말해줘.,0,0,1,0,0,0,0,0
3975,저번주 제주공항 기온 궁금해.,0,0,1,0,0,0,0,0
3976,내일 제주 동부 날씨 상태 알고 싶어요.,0,0,1,0,0,0,0,0
3977,내일 성산일출봉 근처 날씨 알려줘.,0,0,1,0,0,0,0,0
3978,다음주 제주공항 근처 기온 어떠니?,0,0,1,0,0,0,0,0
3979,현재 제주 동부 기상 정보 알고 싶어.,0,0,1,0,0,0,0,0
3980,내일 제주 날씨 상태 어때요?,0,0,1,0,0,0,0,0
3981,내일 모레 우도 날씨 알고 싶어.,0,0,1,0,0,0,0,0
3982,이번주 애월 날씨 상태 어떤가요?,0,0,1,0,0,0,0,0
3983,오늘 제주공항 기온 어떠니?,0,0,1,0,0,0,0,0
3984,내일 모레 제주 기온 알고 싶어요.,0,0,1,0,0,0,0,0
3985,오늘 제주 동부 날씨 상황 알려줘.,0,0,1,0,0,0,0,0
3986,현재 성산일출봉 근처 기온 말해줘.,0,0,1,0,0,0,0,0
3987,이번에 애월 기상 정보 어떤가요?,0,0,1,0,0,0,0,0
3988,오늘 서귀포 기상 정보 알려줘.,0,0,1,0,0,0,0,0
3989,이번주 서귀포 기상 정보 알려줘.,0,0,1,0,0,0,0,0
3990,내일 모레 제주 서부 기온 궁금하다.,0,0,1,0,0,0,0,0
3991,현재 우도 기상 정보 알고 싶어요.,0,0,1,0,0,0,0,0
3992,내일 모레 제주공항 근처 날씨 상황 궁금해요.,0,0,1,0,0,0,0,0
3993,내일 제주 서부 날씨 상태 궁금해.,0,0,1,0,0,0,0,0
3994,내일 모레 성산일출봉 근처 날씨 알고 싶어.,0,0,1,0,0,0,0,0
3995,이번에 제주 동부 기온 궁금하다.,0,0,1,0,0,0,0,0
3996,내일 우도 기상 정보 알고 싶어요.,0,0,1,0,0,0,0,0
3997,지금 우도 기상 정보 어때요?,0,0,1,0,0,0,0,0
3998,내일 모레 우도 날씨 상태 어때요?,0,0,1,0,0,0,0,0
3999,현재 서귀포 기온 궁금하다.,0,0,1,0,0,0,0,0
4000,다음주 성산일출봉 근처 날씨 상황 궁금해요.,0,0,1,0,0,0,0,0
4001,현재 우도 기상 정보 어떤가요?,0,0,1,0,0,0,0,0
4002,저번주 제주 동부 날씨 상황 궁금하다.,0,0,1,0,0,0,0,0
4003,내일 모레 애월 날씨 알려 줄래?,0,0,1,0,0,0,0,0
4004,이번주 서귀포 날씨 어떤지 알려줘.,0,0,1,0,0,0,0,0
4005,이번주 제주 서부 날씨 상태 어떤지 알려줘.,0,0,1,0,0,0,0,0
4006,내일 모레 우도 기온 궁금해요.,0,0,1,0,0,0,0,0
4007,저번주 제주공항 근처 기상 정보 알려줘.,0,0,1,0,0,0,0,0
4008,이번에 서귀포 기상 정보 알고 싶어요.,0,0,1,0,0,0,0,0
4009,이번에 제주공항 기상 정보 어때요?,0,0,1,0,0,0,0,0
4010,내일 우도 날씨 상황 어때요?,0,0,1,0,0,0,0,0
4011,현재 제주 서부 기상 정보 어떠니?,0,0,1,0,0,0,0,0
4012,저번주 제주 날씨 상태 알고 싶어요.,0,0,1,0,0,0,0,0
4013,이번주 애월 기상 정보 어떤지 알려줘.,0,0,1,0,0,0,0,0
4014,내일 성산일출봉 근처 기온 알려줘.,0,0,1,0,0,0,0,0
4015,이번주 서귀포 날씨 상태 어떤지 알려줘.,0,0,1,0,0,0,0,0
4016,이번에 애월 기상 정보 알고 싶어요.,0,0,1,0,0,0,0,0
4017,현재 제주공항 근처 기상 정보 어떠니?,0,0,1,0,0,0,0,0
4018,내일 제주 날씨 상황 궁금해요.,0,0,1,0,0,0,0,0
4019,현재 제주공항 근처 기온 어떤가요?,0,0,1,0,0,0,0,0
4020,내일 모레 제주 동부 기온 어떠니?,0,0,1,0,0,0,0,0
4021,다음주 제주공항 기상 정보 어떤가요?,0,0,1,0,0,0,0,0
4022,현재 제주 동부 날씨 상황 궁금해.,0,0,1,0,0,0,0,0
4023,지금 제주 날씨 어때요?,0,0,1,0,0,0,0,0
4024,다음주 제주 서부 날씨 어때요?,0,0,1,0,0,0,0,0
4025,지금 우도 날씨 알고 싶어.,0,0,1,0,0,0,0,0
4026,이번주 제주 동부 기온 궁금하다.,0,0,1,0,0,0,0,0
4027,이번주 제주공항 날씨 상태 알려줘.,0,0,1,0,0,0,0,0
4028,이번주 우도 날씨 상태 궁금하다.,0,0,1,0,0,0,0,0
4029,저번주 성산일출봉 근처 날씨 상황 알려줘.,0,0,1,0,0,0,0,0
4030,오늘 제주 서부 날씨 상황 말해줘.,0,0,1,0,0,0,0,0
4031,이번에 우도 날씨 상태 알고 싶어.,0,0,1,0,0,0,0,0
4032,지금 제주 동부 기상 정보 알려 줄래?,0,0,1,0,0,0,0,0
4033,이번주 제주공항 날씨 알려줘.,0,0,1,0,0,0,0,0
4034,저번주 우도 기온 궁금해요.,0,0,1,0,0,0,0,0
4035,내일 제주공항 근처 날씨 상황 알려줘.,0,0,1,0,0,0,0,0
4036,이번주 애월 날씨 상황 어떤지 알려줘.,0,0,1,0,0,0,0,0
4037,내일 제주공항 근처 날씨 어때요?,0,0,1,0,0,0,0,0
4038,저번주 애월 날씨 상태 어떠니?,0,0,1,0,0,0,0,0
4039,이번주 제주 서부 기상 정보 알고 싶어.,0,0,1,0,0,0,0,0
4040,내일 제주공항 근처 기온 궁금해요.,0,0,1,0,0,0,0,0
4041,이번에 제주공항 날씨 상태 어떤지 알려줘.,0,0,1,0,0,0,0,0
4042,내일 모레 제주공항 근처 날씨 상태 어때요?,0,0,1,0,0,0,0,0
4043,현재 제주 날씨 상태 궁금해.,0,0,1,0,0,0,0,0
4044,다음주 제주 서부 기상 정보 궁금하다.,0,0,1,0,0,0,0,0
4045,오늘 제주 기온 말해줘.,0,0,1,0,0,0,0,0
4046,현재 우도 날씨 상태 알고 싶어요.,0,0,1,0,0,0,0,0
4047,이번에 제주 서부 기온 어떤지 알려줘.,0,0,1,0,0,0,0,0
4048,지금 제주 서부 날씨 상황 어떤지 알려줘.,0,0,1,0,0,0,0,0
4049,오늘 서귀포 기상 정보 알려 줄래?,0,0,1,0,0,0,0,0
4050,오늘 애월 기상 정보 어떤가요?,0,0,1,0,0,0,0,0
4051,이번에 제주공항 기상 정보 어떤가요?,0,0,1,0,0,0,0,0
4052,다음주 제주 기상 정보 궁금하다.,0,0,1,0,0,0,0,0
4053,현재 우도 날씨 상태 알고 싶어.,0,0,1,0,0,0,0,0
4054,현재 제주 기상 정보 궁금해요.,0,0,1,0,0,0,0,0
4055,내일 모레 제주공항 근처 날씨 말해줘.,0,0,1,0,0,0,0,0
4056,현재 우도 날씨 상태 궁금하다.,0,0,1,0,0,0,0,0
4057,이번주 성산일출봉 근처 날씨 상황 궁금하다.,0,0,1,0,0,0,0,0
4058,내일 제주 동부 날씨 상태 궁금하다.,0,0,1,0,0,0,0,0
4059,저번주 제주 동부 기온 궁금해요.,0,0,1,0,0,0,0,0
4060,이번주 제주공항 기온 궁금하다.,0,0,1,0,0,0,0,0
4061,내일 서귀포 기온 궁금하다.,0,0,1,0,0,0,0,0
4062,지금 제주공항 근처 날씨 궁금해.,0,0,1,0,0,0,0,0
4063,이번주 제주 기온 궁금해.,0,0,1,0,0,0,0,0
4064,이번주 제주공항 날씨 상황 말해줘.,0,0,1,0,0,0,0,0
4065,오늘 애월 날씨 상황 알려줘.,0,0,1,0,0,0,0,0
4066,오늘 성산일출봉 근처 날씨 알고 싶어요.,0,0,1,0,0,0,0,0
4067,이번에 제주 동부 날씨 상황 어떠니?,0,0,1,0,0,0,0,0
4068,이번주 제주 서부 날씨 궁금해요.,0,0,1,0,0,0,0,0
4069,다음주 애월 기온 알려 줄래?,0,0,1,0,0,0,0,0
4070,이번에 제주 기온 어떤지 알려줘.,0,0,1,0,0,0,0,0
4071,내일 모레 성산일출봉 근처 날씨 어떠니?,0,0,1,0,0,0,0,0
4072,지금 성산일출봉 근처 날씨 상황 알려 줄래?,0,0,1,0,0,0,0,0
4073,이번에 제주공항 근처 날씨 상태 어때요?,0,0,1,0,0,0,0,0
4074,다음주 제주 날씨 궁금해.,0,0,1,0,0,0,0,0
4075,다음주 제주 서부 날씨 상태 어떠니?,0,0,1,0,0,0,0,0
4076,저번주 서귀포 날씨 상태 어떤지 알려줘.,0,0,1,0,0,0,0,0
4077,현재 제주 서부 날씨 알고 싶어요.,0,0,1,0,0,0,0,0
4078,다음주 제주 동부 기온 어떠니?,0,0,1,0,0,0,0,0
4079,다음주 제주공항 근처 기상 정보 어떠니?,0,0,1,0,0,0,0,0
4080,내일 애월 기상 정보 알고 싶어요.,0,0,1,0,0,0,0,0
4081,오늘 제주 동부 날씨 상황 궁금해.,0,0,1,0,0,0,0,0
4082,저번주 애월 날씨 상태 알려 줄래?,0,0,1,0,0,0,0,0
4083,내일 제주공항 근처 기상 정보 알려줘.,0,0,1,0,0,0,0,0
4084,오늘 애월 날씨 알려줘.,0,0,1,0,0,0,0,0
4085,이번에 제주 서부 날씨 상황 알려줘.,0,0,1,0,0,0,0,0
4086,다음주 애월 날씨 알고 싶어.,0,0,1,0,0,0,0,0
4087,이번주 제주 서부 날씨 상태 어떠니?,0,0,1,0,0,0,0,0
4088,이번에 제주 서부 날씨 알려줘.,0,0,1,0,0,0,0,0
4089,현재 서귀포 기상 정보 알고 싶어요.,0,0,1,0,0,0,0,0
4090,이번주 우도 기상 정보 궁금해요.,0,0,1,0,0,0,0,0
4091,이번주 제주 기온 궁금하다.,0,0,1,0,0,0,0,0
4092,지금 제주공항 근처 기상 정보 알고 싶어요.,0,0,1,0,0,0,0,0
4093,현재 제주공항 근처 기상 정보 알려줘.,0,0,1,0,0,0,0,0
4094,현재 애월 기상 정보 궁금해요.,0,0,1,0,0,0,0,0
4095,저번주 제주공항 근처 날씨 상태 궁금하다.,0,0,1,0,0,0,0,0
4096,내일 성산일출봉 근처 날씨 상태 어떤가요?,0,0,1,0,0,0,0,0
4097,이번에 성산일출봉 근처 날씨 상태 알려 줄래?,0,0,1,0,0,0,0,0
4098,이번주 성산일출봉 근처 날씨 상태 알고 싶어.,0,0,1,0,0,0,0,0
4099,다음주 제주공항 근처 날씨 궁금하다.,0,0,1,0,0,0,0,0
4100,지금 우도 날씨 상황 궁금해.,0,0,1,0,0,0,0,0
4101,오늘 제주 서부 날씨 상황 알려줘.,0,0,1,0,0,0,0,0
4102,현재 제주 동부 날씨 어때요?,0,0,1,0,0,0,0,0
4103,이번에 우도 날씨 상황 어때요?,0,0,1,0,0,0,0,0
4104,지금 제주 기상 정보 어떤가요?,0,0,1,0,0,0,0,0
4105,이번주 제주 서부 기상 정보 알려 줄래?,0,0,1,0,0,0,0,0
4106,내일 성산일출봉 근처 기상 정보 어떤지 알려줘.,0,0,1,0,0,0,0,0
4107,내일 모레 제주공항 근처 날씨 상황 궁금하다.,0,0,1,0,0,0,0,0
4108,이번에 성산일출봉 근처 날씨 알고 싶어요.,0,0,1,0,0,0,0,0
4109,이번에 제주공항 기온 말해줘.,0,0,1,0,0,0,0,0
4110,오늘 제주 날씨 상황 어떠니?,0,0,1,0,0,0,0,0
4111,이번주 제주공항 기온 어떤지 알려줘.,0,0,1,0,0,0,0,0
4112,이번주 제주공항 기상 정보 알려 줄래?,0,0,1,0,0,0,0,0
4113,저번주 우도 기상 정보 궁금해요.,0,0,1,0,0,0,0,0
4114,오늘 제주 날씨 상태 궁금하다.,0,0,1,0,0,0,0,0
4115,내일 성산일출봉 근처 날씨 상황 궁금하다.,0,0,1,0,0,0,0,0
4116,오늘 제주 날씨 상태 말해줘.,0,0,1,0,0,0,0,0
4117,이번주 애월 날씨 상태 알려 줄래?,0,0,1,0,0,0,0,0
4118,이번에 제주공항 근처 날씨 상태 궁금해요.,0,0,1,0,0,0,0,0
4119,내일 제주 서부 기온 어떤지 알려줘.,0,0,1,0,0,0,0,0
4120,현재 성산일출봉 근처 기상 정보 말해줘.,0,0,1,0,0,0,0,0
4121,이번주 제주공항 날씨 상태 말해줘.,0,0,1,0,0,0,0,0
4122,내일 모레 제주공항 날씨 상태 말해줘.,0,0,1,0,0,0,0,0
4123,지금 제주공항 날씨 어때요?,0,0,1,0,0,0,0,0
4124,내일 모레 제주 서부 날씨 상황 알고 싶어.,0,0,1,0,0,0,0,0
4125,이번에 제주 서부 기상 정보 궁금하다.,0,0,1,0,0,0,0,0
4126,오늘 성산일출봉 근처 기상 정보 알려 줄래?,0,0,1,0,0,0,0,0
4127,내일 제주 날씨 상황 어떤가요?,0,0,1,0,0,0,0,0
4128,다음주 서귀포 날씨 상황 궁금해요.,0,0,1,0,0,0,0,0
4129,현재 제주공항 날씨 상황 궁금하다.,0,0,1,0,0,0,0,0
4130,이번주 제주공항 근처 기상 정보 알려줘.,0,0,1,0,0,0,0,0
4131,이번주 제주 날씨 궁금해요.,0,0,1,0,0,0,0,0
4132,내일 제주공항 근처 기온 궁금해.,0,0,1,0,0,0,0,0
4133,이번주 제주공항 기상 정보 궁금하다.,0,0,1,0,0,0,0,0
4134,이번주 제주 서부 날씨 상황 알고 싶어.,0,0,1,0,0,0,0,0
4135,지금 제주공항 근처 기상 정보 알고 싶어.,0,0,1,0,0,0,0,0
4136,내일 모레 우도 날씨 상황 궁금해.,0,0,1,0,0,0,0,0
4137,다음주 제주 날씨 상황 알고 싶어요.,0,0,1,0,0,0,0,0
4138,저번주 제주 동부 날씨 상태 궁금해.,0,0,1,0,0,0,0,0
4139,내일 서귀포 기온 어떤지 알려줘.,0,0,1,0,0,0,0,0
4140,이번에 애월 날씨 상황 궁금해요.,0,0,1,0,0,0,0,0
4141,지금 애월 기상 정보 말해줘.,0,0,1,0,0,0,0,0
4142,지금 제주공항 근처 기온 알려줘.,0,0,1,0,0,0,0,0
4143,이번주 우도 기온 궁금해요.,0,0,1,0,0,0,0,0
4144,저번주 제주공항 날씨 상황 궁금해.,0,0,1,0,0,0,0,0
4145,저번주 성산일출봉 근처 기온 알려줘.,0,0,1,0,0,0,0,0
4146,다음주 우도 날씨 상태 궁금해요.,0,0,1,0,0,0,0,0
4147,이번주 성산일출봉 근처 기온 말해줘.,0,0,1,0,0,0,0,0
4148,지금 우도 날씨 상태 알려줘.,0,0,1,0,0,0,0,0
4149,오늘 제주 서부 날씨 어떤지 알려줘.,0,0,1,0,0,0,0,0
4150,저번주 성산일출봉 근처 날씨 궁금해.,0,0,1,0,0,0,0,0
4151,다음주 애월 날씨 상태 어떤지 알려줘.,0,0,1,0,0,0,0,0
4152,오늘 애월 기상 정보 알고 싶어요.,0,0,1,0,0,0,0,0
4153,다음주 우도 날씨 상황 어떤가요?,0,0,1,0,0,0,0,0
4154,현재 제주공항 날씨 알고 싶어요.,0,0,1,0,0,0,0,0
4155,다음주 제주공항 근처 날씨 상태 어때요?,0,0,1,0,0,0,0,0
4156,저번주 제주 기온 알려 줄래?,0,0,1,0,0,0,0,0
4157,다음주 제주 서부 날씨 어떤지 알려줘.,0,0,1,0,0,0,0,0
4158,내일 모레 우도 날씨 상태 궁금하다.,0,0,1,0,0,0,0,0
4159,이번주 제주 동부 날씨 궁금해요.,0,0,1,0,0,0,0,0
4160,다음주 제주 동부 기상 정보 어떤가요?,0,0,1,0,0,0,0,0
4161,오늘 제주 동부 날씨 상태 궁금해.,0,0,1,0,0,0,0,0
4162,이번에 제주공항 기온 어떠니?,0,0,1,0,0,0,0,0
4163,이번주 서귀포 날씨 상태 말해줘.,0,0,1,0,0,0,0,0
4164,다음주 제주 날씨 어떠니?,0,0,1,0,0,0,0,0
4165,이번주 서귀포 날씨 상태 알고 싶어.,0,0,1,0,0,0,0,0
4166,저번주 제주 동부 기온 어떤가요?,0,0,1,0,0,0,0,0
4167,내일 모레 제주공항 날씨 상황 알려줘.,0,0,1,0,0,0,0,0
4168,이번에 우도 기온 알려줘.,0,0,1,0,0,0,0,0
4169,지금 제주공항 근처 날씨 상황 어떠니?,0,0,1,0,0,0,0,0
4170,이번에 서귀포 날씨 알고 싶어요.,0,0,1,0,0,0,0,0
4171,이번주 제주 서부 기상 정보 어때요?,0,0,1,0,0,0,0,0
4172,저번주 성산일출봉 근처 날씨 상태 알고 싶어.,0,0,1,0,0,0,0,0
4173,오늘 성산일출봉 근처 기온 궁금하다.,0,0,1,0,0,0,0,0
4174,현재 성산일출봉 근처 기상 정보 어떤지 알려줘.,0,0,1,0,0,0,0,0
4175,저번주 제주공항 날씨 상황 궁금해요.,0,0,1,0,0,0,0,0
4176,저번주 제주공항 근처 날씨 어떠니?,0,0,1,0,0,0,0,0
4177,이번주 애월 날씨 알고 싶어요.,0,0,1,0,0,0,0,0
4178,이번에 우도 날씨 상황 알고 싶어.,0,0,1,0,0,0,0,0
4179,오늘 우도 기상 정보 어떤지 알려줘.,0,0,1,0,0,0,0,0
4180,이번주 제주 서부 기상 정보 알려줘.,0,0,1,0,0,0,0,0
4181,이번에 애월 날씨 상황 알려 줄래?,0,0,1,0,0,0,0,0
4182,지금 제주 서부 날씨 상태 어떤가요?,0,0,1,0,0,0,0,0
4183,지금 성산일출봉 근처 기상 정보 알고 싶어.,0,0,1,0,0,0,0,0
4184,지금 성산일출봉 근처 날씨 상황 어때요?,0,0,1,0,0,0,0,0
4185,지금 제주 서부 기상 정보 알고 싶어요.,0,0,1,0,0,0,0,0
4186,현재 애월 날씨 상황 알려줘.,0,0,1,0,0,0,0,0
4187,내일 모레 서귀포 날씨 상태 알려줘.,0,0,1,0,0,0,0,0
4188,내일 제주 동부 날씨 상황 알려 줄래?,0,0,1,0,0,0,0,0
4189,내일 애월 기상 정보 어떤가요?,0,0,1,0,0,0,0,0
4190,이번에 서귀포 날씨 상황 알고 싶어요.,0,0,1,0,0,0,0,0
4191,내일 모레 서귀포 기온 알고 싶어.,0,0,1,0,0,0,0,0
4192,현재 제주 동부 날씨 말해줘.,0,0,1,0,0,0,0,0
4193,이번에 제주 서부 날씨 상황 궁금해요.,0,0,1,0,0,0,0,0
4194,오늘 제주 날씨 상태 알려 줄래?,0,0,1,0,0,0,0,0
4195,이번주 제주 동부 날씨 상태 어떠니?,0,0,1,0,0,0,0,0
4196,오늘 성산일출봉 근처 날씨 상황 궁금해요.,0,0,1,0,0,0,0,0
4197,저번주 성산일출봉 근처 날씨 상태 궁금해.,0,0,1,0,0,0,0,0
4198,이번주 우도 기상 정보 어떤가요?,0,0,1,0,0,0,0,0
4199,이번에 서귀포 날씨 상태 궁금하다.,0,0,1,0,0,0,0,0
